{
  "schema_version": "1.0",
  "handoff_id": "e2a8f3b4-51c6-4d7e-a9f0-1b2c3d4e5f03",
  "created_at": "2026-10-07T12:05:00-06:00",
  "source_agent": "mifos-x-ai-agent-customer-service-advisor",
  "route": "OPERATIONS",
  "route_reason": "Existing customer asks about the status of an active loan.",
  "customer": {
    "entity_type": "INDIVIDUAL",
    "existing_customer": "YES",
    "fineract_client_id": null,
    "reference_number": "REF-20431",
    "preferred_channel": "PHONE"
  },
  "need": {
    "type": "INQUIRY",
    "approx_amount": null,
    "currency": null,
    "desired_term": null,
    "liquidity_need": null,
    "purpose": null,
    "formal_income_proof": null,
    "inquiry_reason": "Status of an active loan"
  },
  "filters_triggered": [
    { "id": 6, "name": "Formal complaint, claim, or status question", "escalate": true },
    { "id": 7, "name": "Sensitive personal data via chat", "escalate": false }
  ],
  "escalation_required": true,
  "active_process": true,
  "urgency": "NORMAL",
  "documents_mentioned": [],
  "conversation_summary": "Existing customer asked for the status of an active loan and tried to share an ID number in the chat. The customer was asked not to share sensitive data here; no status was given.",
  "customer_confirmed_transfer": true,
  "next_step": "Operations will call the customer to follow up on the loan status through a secure channel."
}
